{
  "schema_version": 1,
  "generated_at": "2026-10-10T00:00:00Z",
  "minimum_reshade_version": "6.7.0",
  "games": [
    {
      "id": "alfred-hitchcock-vertigo",
      "name": "Alfred Hitchcock - Vertigo",
      "architecture": "X64",
      "status": "working",
      "match": [
        {
          "kind": "steam_appid",
          "value": "1449320",
          "tier": 100
        },
        {
          "kind": "exe_name",
          "value": "Vertigo.exe",
          "tier": 70
        }
      ],
      "package": {
        "release_asset": "Luma-Unity_Engine.zip",
        "addon_file": "Luma-Unity Engine.addon"
      },
      "profile": "unity"
    },
    {
      "id": "burnout-paradise-remastered",
      "name": "Burnout Paradise Remastered",
      "architecture": "X86",
      "status": "working",
      "match": [
        {
          "kind": "steam_appid",
          "value": "1238080",
          "tier": 100
        }
      ],
      "package": {
        "release_asset": "Luma-Burnout_Paradise_Remastered-x32.zip",
        "addon_file": "Luma-Burnout Paradise Remastered.addon"
      },
      "profile": "game"
    },
    {
      "id": "cod-black-ops-3",
      "name": "Call of Duty: Black Ops III",
      "architecture": "X64",
      "status": "working",
      "match": [
        {
          "kind": "steam_appid",
          "value": "311210",
          "tier": 100
        },
        {
          "kind": "exe_name",
          "value": "blackops3.exe",
          "tier": 70
        }
      ],
      "package": {
        "release_asset": "Luma-Call_of_Duty_Black_Ops_3.zip",
        "addon_file": "Luma-Call of Duty Black Ops 3.addon"
      },
      "profile": "game",
      "guidance": [
        {
          "id": "luma.cod-black-ops-3.warning",
          "kind": "warning",
          "fallback_text": "Avoid official public matchmaking while Luma is installed. This may result in a ban."
        }
      ]
    },
    {
      "id": "cocoon",
      "name": "Cocoon",
      "architecture": "X64",
      "status": "working",
      "match": [
        {
          "kind": "steam_appid",
          "value": "1497440",
          "tier": 100
        },
        {
          "kind": "exe_name",
          "value": "universe.exe",
          "tier": 70
        }
      ],
      "package": {
        "release_asset": "Luma-Unity_Engine.zip",
        "addon_file": "Luma-Unity Engine.addon"
      },
      "profile": "unity"
    },
    {
      "id": "deus-ex-human-revolution",
      "name": "Deus Ex: Human Revolution",
      "architecture": "X86",
      "status": "working",
      "match": [
        {
          "kind": "steam_appid",
          "value": "238010",
          "tier": 100
        },
        {
          "kind": "exe_name",
          "value": "DXHRDC.exe",
          "tier": 70
        }
      ],
      "package": {
        "release_asset": "Luma-Deus_Ex_Human_Revolution_Director.s_Cut-x32.zip",
        "addon_file": "Luma-Deus Ex Human Revolution Director's Cut.addon"
      },
      "profile": "game",
      "guidance": [
        {
          "id": "luma.deus-ex-human-revolution.compatibility",
          "kind": "compatibility",
          "fallback_text": "Not compatible with Boris ENB (DX9). Compatible with the Director's Cut and original edition. The Gold Filter Restoration mod is redundant with Luma."
        }
      ]
    },
    {
      "id": "dishonored-2",
      "name": "Dishonored 2",
      "architecture": "X64",
      "status": "construction",
      "match": [
        {
          "kind": "steam_appid",
          "value": "403640",
          "tier": 100
        },
        {
          "kind": "exe_name",
          "value": "Dishonored2.exe",
          "tier": 70
        }
      ],
      "package": {
        "release_asset": "Luma-Dishonored_2.zip",
        "addon_file": "Luma-Dishonored 2.addon"
      },
      "profile": "game"
    },
    {
      "id": "far-changing-tides",
      "name": "FAR: Changing Tides",
      "architecture": "X64",
      "status": "working",
      "match": [
        {
          "kind": "steam_appid",
          "value": "1570010",
          "tier": 100
        },
        {
          "kind": "exe_name",
          "value": "FarChangingTides.exe",
          "tier": 70
        }
      ],
      "package": {
        "release_asset": "Luma-Unity_Engine.zip",
        "addon_file": "Luma-Unity Engine.addon"
      },
      "profile": "unity"
    },
    {
      "id": "far-lone-sails",
      "name": "FAR: Lone Sails",
      "architecture": "X64",
      "status": "working",
      "match": [
        {
          "kind": "steam_appid",
          "value": "609320",
          "tier": 100
        },
        {
          "kind": "exe_name",
          "value": "FarLoneSails.exe",
          "tier": 70
        }
      ],
      "package": {
        "release_asset": "Luma-Unity_Engine.zip",
        "addon_file": "Luma-Unity Engine.addon"
      },
      "profile": "unity"
    },
    {
      "id": "final-fantasy-7-remake",
      "name": "Final Fantasy VII Remake",
      "architecture": "X64",
      "status": "working",
      "match": [
        {
          "kind": "steam_appid",
          "value": "1462040",
          "tier": 100
        },
        {
          "kind": "exe_name",
          "value": "ff7remake.exe",
          "tier": 70
        }
      ],
      "package": {
        "release_asset": "Luma-Final_Fantasy_VII_Remake.zip",
        "addon_file": "Luma-Final Fantasy VII Remake.addon"
      },
      "profile": "game"
    },
    {
      "id": "granblue-fantasy-relink",
      "name": "Granblue Fantasy: Relink",
      "architecture": "X64",
      "status": "working",
      "match": [
        {
          "kind": "steam_appid",
          "value": "881020",
          "tier": 100
        },
        {
          "kind": "exe_name",
          "value": "granblue_fantasy_relink.exe",
          "tier": 70
        }
      ],
      "package": {
        "release_asset": "Luma-Granblue_Fantasy_Relink.zip",
        "addon_file": "Luma-Granblue Fantasy Relink.addon"
      },
      "profile": "game"
    },
    {
      "id": "greedfall",
      "name": "GreedFall",
      "architecture": "X64",
      "status": "working",
      "match": [
        {
          "kind": "steam_appid",
          "value": "606880",
          "tier": 100
        },
        {
          "kind": "exe_name",
          "value": "GreedFall.exe",
          "tier": 70
        }
      ],
      "package": {
        "release_asset": "Luma-Greedfall.zip",
        "addon_file": "Luma-GreedFall.addon"
      },
      "profile": "game",
      "guidance": [
        {
          "id": "luma.greedfall.warning",
          "kind": "warning",
          "fallback_text": "This profile supports DLSS only; HDR is not currently supported."
        }
      ]
    },
    {
      "id": "hatsune-miku-project-diva-mega-mix-plus",
      "name": "Hatsune Miku: Project DIVA Mega Mix+",
      "architecture": "X64",
      "status": "working",
      "match": [
        {
          "kind": "steam_appid",
          "value": "1761390",
          "tier": 100
        },
        {
          "kind": "exe_name",
          "value": "DivaMegaMix.exe",
          "tier": 70
        }
      ],
      "package": {
        "release_asset": "Luma-Project_Diva_Mega_Mix.zip",
        "addon_file": "Luma-Project Diva Mega Mix.addon"
      },
      "profile": "game",
      "guidance": [
        {
          "id": "luma.hatsune-miku-project-diva-mega-mix-plus.warning",
          "kind": "warning",
          "fallback_text": "If display issues occur, avoid Exclusive Fullscreen. Press Alt+Enter to switch modes."
        }
      ]
    },
    {
      "id": "heavy-rain",
      "name": "Heavy Rain",
      "architecture": "X64",
      "status": "working",
      "match": [
        {
          "kind": "steam_appid",
          "value": "960910",
          "tier": 100
        },
        {
          "kind": "exe_name",
          "value": "HeavyRain.exe",
          "tier": 70
        }
      ],
      "package": {
        "release_asset": "Luma-Heavy_Rain.zip",
        "addon_file": "Luma-Heavy Rain.addon"
      },
      "profile": "game",
      "guidance": [
        {
          "id": "luma.heavy-rain.warning",
          "kind": "warning",
          "fallback_text": "Ultrawide support may only work on Steam."
        }
      ]
    },
    {
      "id": "hollow-knight-silksong",
      "name": "Hollow Knight: Silksong",
      "architecture": "X64",
      "status": "working",
      "match": [
        {
          "kind": "steam_appid",
          "value": "1030300",
          "tier": 100
        },
        {
          "kind": "exe_name",
          "value": "Hollow Knight Silksong.exe",
          "tier": 70
        }
      ],
      "package": {
        "release_asset": "Luma-Unity_Engine.zip",
        "addon_file": "Luma-Unity Engine.addon"
      },
      "profile": "unity"
    },
    {
      "id": "prince-of-persia-the-lost-crown",
      "name": "Prince of Persia: The Lost Crown",
      "architecture": "X64",
      "status": "working",
      "match": [
        {
          "kind": "steam_appid",
          "value": "2751000",
          "tier": 100
        },
        {
          "kind": "exe_name",
          "value": "TheLostCrown.exe",
          "tier": 70
        }
      ],
      "package": {
        "release_asset": "Luma-Unity_Engine.zip",
        "addon_file": "Luma-Unity Engine.addon"
      },
      "profile": "unity"
    },
    {
      "id": "shadows-of-doubt",
      "name": "Shadows of Doubt",
      "architecture": "X64",
      "status": "working",
      "match": [
        {
          "kind": "steam_appid",
          "value": "986130",
          "tier": 100
        }
      ],
      "package": {
        "release_asset": "Luma-Unity_Engine.zip",
        "addon_file": "Luma-Unity Engine.addon"
      },
      "profile": "unity"
    },
    {
      "id": "white-knuckle",
      "name": "White Knuckle",
      "architecture": "X64",
      "status": "working",